{
  "manifest": "uncut.module/0",
  "id": "move.word-by-word",
  "kind": "move",
  "name": "Word by word",
  "version": "0.1.0",
  "author": "Uncut",
  "license": "MIT",
  "builtin": true,
  "runtime": {
    "type": "html"
  },
  "description": "Text: the words appear one after another over the move's length (in), or leave in the same order (out).",
  "params": {
    "type": "object",
    "properties": {
      "style": {
        "enum": [
          "pop",
          "fade",
          "rise"
        ],
        "default": "pop",
        "description": "How each word arrives: pop (grows from 60 % with a little overshoot), fade, or rise (fades in moving up)."
      }
    }
  }
}
