{
  "manifest": "uncut.module/0",
  "id": "move.pop",
  "kind": "move",
  "name": "Pop",
  "version": "0.1.0",
  "author": "Uncut",
  "license": "MIT",
  "builtin": true,
  "runtime": {
    "type": "html"
  },
  "description": "Text: pops in from 40 % with an overshoot, quickly appearing (in); pops out the same way, reversed (out).",
  "params": {
    "type": "object",
    "properties": {
      "ease": {
        "enum": [
          "linear",
          "in",
          "out",
          "inOut",
          "spring",
          "spring.snap",
          "spring.settle",
          "spring.land",
          "spring.bounce"
        ],
        "description": "Optional: reshapes the motion (not the fade): linear, in, out, inOut (cubic) or a spring (spring.snap, spring.settle or spring, spring.land, spring.bounce: fitted to the move's duration, may overshoot) (D192). Without it the move keeps its own curve."
      }
    }
  }
}
