{
  "manifest": "uncut.module/0",
  "id": "component.zoom-pan",
  "kind": "component",
  "name": "Zoom and pan",
  "version": "0.1.0",
  "author": "Uncut",
  "license": "MIT",
  "builtin": true,
  "runtime": {
    "type": "html"
  },
  "params": {
    "type": "object",
    "additionalProperties": false,
    "properties": {
      "from": {
        "type": "object"
      },
      "to": {
        "type": "object"
      }
    }
  },
  "ui": {
    "panel": "components",
    "icon": "scan"
  }
}
